# ััะธัะธ, ะฒััะตะบะฐััะธะต

ะััะตะผ ะฎัะบะพะฒัะบะธะน

> _(ัะต, ััะพ ั ะปะฐะฟะบะฐะผะธ ๐พ - ะปัะฑะธะผัะต)_

## 2025
- [ะดะตะฒััะบะธ ะดะปั ะผะตะฝั (04.04.2025) ๐พ๐พ](2025-04-04.ะดะตะฒััะบะธ-ะดะปั-ะผะตะฝั.md)
- [ัะตะทะพะฝ ัะฟะฐัะถะธ (03.04.2025) ๐พ๐พ](2025-04-03.ัะตะทะพะฝ-ัะฟะฐัะถะธ.md)

## 2024
- [ะฑะพััั ััะฝััั. ัะปะธะฟะฐัั ะฒะตะบะธ. (06-10.2024) ๐พ](2024-10-14.ะฑะพััั-ััะฝััั-ัะปะธะฟะฐัั-ะฒะตะบะธ.md)
- [ัััะบะปะพะน ะปะฐะผะฟะพัะบะพะน ะฑะปะตะดะฝะพะน (14.10.2024) ๐พ๐พ๐พ](2024-10-14.ัััะบะปะพะน-ะปะฐะผะฟะพัะบะพะน-ะฑะปะตะดะฝะพะน.md)
- [ะฝะตะผะตัะบะธะน ะฑัั (13.10.2024)](2024-10-13.ะฝะตะผะตัะบะธะน-ะฑัั.md)
- [ะณะพะปะพะฒะพัะตะทั ะธ "ะบะธะฝะถะฐะปั" (08.07.2024) ๐พ๐พ๐พ](2024-07-08.ะณะพะปะพะฒะพัะตะทั-ะธ-ะบะธะฝะถะฐะปั.md)
- [ะฝะพะนะบัะปะปัะฝ (04.07.2024) ๐พ](2024-07-04.ะฝะพะนะบัะปะปัะฝ.md)
- [ะฟะพัั ะฟะพะดัััะธะณัั! ะบัะดัะธ ะฟัะพัั! (22.06.2024) ๐พ๐พ](2024-06-22.ะฟะพัั-ะฟะพะดัััะธะณัั-ะบัะดัะธ-ะฟัะพัั.md)
- [ะฒ ะณะพะปะพะฒะต ะฝะต ััะธัะฐะตั, ะฟะพ ะบะพะถะต ััััะธั (27.05.2024)](2024-05-27.ะฒ-ะณะพะปะพะฒะต-ะฝะต-ััะธัะฐะตั-ะฟะพ-ะบะพะถะต-ััััะธั.md)
- [ััะตะดะฐะตั ะดะฝะธ ะณะพะปะพะดะฝัะน ะฒะตัะตั (01-06.2024) ๐พ๐พ๐พ](2024-01-04.ััะตะดะฐะตั-ะดะฝะธ-ะณะพะปะพะดะฝัะน-ะฒะตัะตั.md)

## 2023
- [ะพะฑัะตััะฝะฝะพััั ัะดะฐะฒะปะธะฒะฐะตั ัะตัะดัะต (18.12.2023 - 01.01.2024)](2023-12-18.ะพะฑัะตัะตะฝะฝะพััั-ัะดะฐะฒะปะธะฒะฐะตั-ัะตัะดัะต.md)
- [ะฒะตััะฝะธะน ะปะฐัั (16.12.2023)](2023-12-16.ะฒะตััะฝะธะน-ะปะฐัั.md)
- [ะบััะณะฐะผะธ ะผััะปะธ ัะพะดัั, ะฟะพ ะบััะณั (27.11.2023) ๐พ](2023-11-27.ะบััะณะฐะผะธ-ะผััะปะธ-ัะพะดัั-ะฟะพ-ะบััะณั.md)
- [ััะฑะฑะพัะฐ. ัััะพ. ะดะพะถะดั ะธ ัะฝะตะณ. (25.11.2023)](2023-11-25.ััะฑะฑะพัะฐ-ัััะพ-ะดะพะถะดั-ะธ-ัะฝะตะณ.md)
- [ะทะฐัะตะผ ััะธัะธ ะผะพะธ ะฟะตัะฐะปัะฝั? (23.11.2023)](2023-11-23.ะทะฐัะตะผ-ััะธัะธ-ะผะพะธ-ะฟะตัะฐะปัะฝั.md)
- [ะผะพัะพะท ะฟะพ ะพะบะฝะฐะผ (22.11.2023) ๐พ๐พ](2023-11-22.ะผะพัะพะท-ะฟะพ-ะพะบะฝะฐะผ.md)
- [ะฟะพะผะฝั ะฑะตะปัะต ะฝะพัะธ (20.11.2023)](2023-11-20.ะฟะพะผะฝั-ะฑะตะปัะต-ะฝะพัะธ.md)
- [et chaque semaine ressemble aux autres (19.11.2023)](2023-11-19_07.et-chaque-semaine-rassemble-aux-autres.md)
- [ัะธะถั ะพะดะธะฝ. ะดะพะถะดะปะธะฒัะน ะฒะตัะตั (19.11.2023) ๐พ](2023-11-19_06.ัะธะถั-ะพะดะธะฝ-ะดะพะปะถะดะปะธะฒัะน-ะฒะตัะตั.md)
- [ะฝะตะพะฑัะพะดะธะผะพััั ะฑะตะถะฐัั (19.11.2023) ๐พ](2023-11-19_05.ะฝะตะพะฑัะพะดะธะผะพััั-ะฑะตะถะฐัั.md)
- [ัะบะฐะถะธ ะธ ั ะทะฐะบัะพั ะพะบะฝะฐ (19.11.2023)](2023-11-19_04.ัะบะฐะถะธ-ะธ-ั-ะทะฐะบัะพั-ะพะบะฝะฐ.md)
- [ัััะฐะปะพััั. ััะตะฒะพะณะฐ ะธ ัััะฐั. (19.11.2023) ๐พ](2023-11-19_03.ัััะฐะปะพััั-ััะตะฒะพะณะฐ-ะธ-ัััะฐั.md)
- [ะทะฐ ะพะบะฝะพะผ ะฟะพะดะฝะธะผะฐะตััั ัััะพ (19.11.2023) ๐พ](2023-11-19_02.ะทะฐ-ะพะบะฝะพะผ-ะฟะพะดะฝะธะผะฐะตััั-ัััะพ)
- [ะบะพะณะดะฐ-ะฝะธะฑัะดั ะฝะตะฑะพ ะฟะพัััะฝะตั (19.11.2023)](2023-11-19_01.ะบะพะณะดะฐ-ะฝะธะฑัะดั-ะฝะตะฑะพ-ะฟะพัััะฝะตั.md)

